{
  "$schema": "../schema/background-catalogue.schema.json",
  "id": "background-catalogue",
  "type": "background-catalogue",
  "description": "The real, complete SF2E background catalogue (154 entries), extracted live from gamesystems/sf2e/packs/backgrounds for the induction terminal Page 3 (design/induction-terminal.md). Skill/Lore/feat grants are informational only -- some real backgrounds offer a prose CHOICE (e.g. Starship Dweller: trained in the Crafting or Piloting skill) that this flat shape cannot represent; the description text is always the source of truth, never overridden by the terminal.",
  "backgrounds": [
    {
      "id": "absalom-local",
      "name": "Absalom Local",
      "rarity": "common",
      "boosts": [
        [
          "cha",
          "wis"
        ],
        [
          "cha",
          "con",
          "dex",
          "int",
          "str",
          "wis"
        ]
      ],
      "trainedSkills": [
        "society"
      ],
      "loreSkills": [
        "Absalom Station Lore"
      ],
      "feat": "Streetwise",
      "description": "You've made the Lorespire Complex your home and are immersed in the culture of Absalom Station. While most Starfinders can't wait to leave the station and explore the distant galaxy, you know Absalom Station hides enough mysteries and secrets to keep you busy for a dozen lifetimes. Choose two attribute boosts. One must be to Wisdom or Charisma, and one is a free attribute boost. You're trained in the Society skill and the Absalom Station Lore skill. You gain the Streetwise skill feat."
    },
    {
      "id": "acolyte-grave-world",
      "name": "Acolyte (Grave World)",
      "rarity": "uncommon",
      "boosts": [
        [
          "con",
          "wis"
        ],
        [
          "cha",
          "con",
          "dex",
          "int",
          "str",
          "wis"
        ]
      ],
      "trainedSkills": [
        "survival"
      ],
      "loreSkills": [],
      "feat": "Urban Survivalist",
      "description": "You've joined the Xenowardens because you care deeply about nature and conserving natural resources. You find ways to connect with nature in even the most unlikely places, and you're an advocate for helpless creatures. Choose two attribute boosts. One must be Constitution or Wisdom, and one is a free attribute boost. You are trained in the Survival skill and either the Cooking or Life Science Lore skill. You gain the Urban Survivalist skill feat."
    },
    {
      "id": "acquistive",
      "name": "Acquistive",
      "rarity": "common",
      "boosts": [
        [
          "cha",
          "wis"
        ],
        [
          "cha",
          "con",
          "dex",
          "int",
          "str",
          "wis"
        ]
      ],
      "trainedSkills": [
        "deception"
      ],
      "loreSkills": [
        "Media Lore"
      ],
      "feat": "Charming Liar",
      "description": "While most Starfinders joined the Society for a chance to explore the galaxy or uncover ancient history, you joined for far more practical reasons: wealth, fame, and power! You intend to use your status as a Starfinder to make contacts, seize opportunities, become a media sensation, and, of course, get rich. Choose two attribute boosts. One must be to Wisdom or Charisma, and one is a free attribute boost. You're trained in the Deception skill and the Media Lore skill. You gain the Charming Liar skill feat."
    },
    {
      "id": "advocate",
      "name": "Advocate",
      "rarity": "common",
      "boosts": [
        [
          "cha",
          "wis"
        ],
        [
          "cha",
          "con",
          "dex",
          "int",
          "str",
          "wis"
        ]
      ],
      "trainedSkills": [],
      "loreSkills": [
        "Legal Lore"
      ],
      "feat": null,
      "description": "You love being a member of the Starfinder Society, and deeply cherish the bonds you've formed with your fellow Starfinders. Inspired by these bonds, your moral compass, a sense of justice, or perhaps fellow Starfinder Zigvigix's public effort, you advocate for the betterment of all Starfinders. Sometimes this means lobbying to improve work conditions and support systems, sometimes this means volunteering your time to causes and services you believe make a positive impact, and sometimes this means healing wounds, assisting with recovery, or offering a compassionate shoulder to lean on to a Starfinder in need. Choose two attribute boosts. One must be to Wisdom or Charisma, and one is a free attribute boost. You're trained in your choice of either the Diplomacy or the Medicine skill, and the Legal Lore skill. If you choose Diplomacy, you gain the No Cause for Alarm skill feat. If you choose Medicine, you gain the Battle Medicine skill feat."
    },
    {
      "id": "akashic-recorder",
      "name": "Akashic Recorder",
      "rarity": "uncommon",
      "boosts": [
        [
          "int",
          "wis"
        ],
        [
          "cha",
          "con",
          "dex",
          "int",
          "str",
          "wis"
        ]
      ],
      "trainedSkills": [
        "occultism"
      ],
      "loreSkills": [],
      "feat": "Assurance",
      "description": "Your mind is mystically linked to the Akashic Record, an astral repository of all knowledge and memory. You might be a member of the Akashic Society. Choose two attribute boosts. One must be to Intelligence or Wisdom, and one is a free attribute boost. You're trained in the Occultism skill and a Lore skill of your choice. You gain the Assurance skill feat with one of the skills granted by this background."
    },
    {
      "id": "akitonian-explorer",
      "name": "Akitonian Explorer",
      "rarity": "common",
      "boosts": [
        [
          "con",
          "wis"
        ],
        [
          "cha",
          "con",
          "dex",
          "int",
          "str",
          "wis"
        ]
      ],
      "trainedSkills": [
        "survival"
      ],
      "loreSkills": [
        "Akiton Lore"
      ],
      "feat": "Terrain Expertise",
      "description": "You've been to the planet Akiton before, perhaps for a vacation, to visit a friend, through your work with the Starfinder Society, or because it's your home. You're accustomed to the hardscrabble life its citizens lead and know how to survive the region's badlands and wastelands in case of emergency. Choose two attribute boosts. One must be to Constitution or Wisdom, and one is a free attribute boost. You're trained in the Survival skill and the Akiton Lore skill. You gain the Terrain Expertise skill feat, selecting one of the following terrains: arctic, desert, mountain, or plains."
    },
    {
      "id": "alien-hunter",
      "name": "Alien Hunter",
      "rarity": "uncommon",
      "boosts": [
        [
          "dex",
          "wis"
        ],
        [
          "cha",
          "con",
          "dex",
          "int",
          "str",
          "wis"
        ]
      ],
      "trainedSkills": [
        "survival"
      ],
      "loreSkills": [
        "Life Science Lore"
      ],
      "feat": "Experienced Tracker",
      "description": "Access You played Starfinder Playtest Scenario #2: It Came from the Vast! during the Starfinder Second Edition PlaytestYou explored the Xenowardens starship Bloom and teamed up with a ghost to destroy Sample 62, a vicious alien monster that killed the starship's crew. The experience shaped you, and you understand that sometimes alien creatures must be destroyed to protect the wider region or galaxy. Choose two attribute boosts. One must be to Dexterity or Wisdom, and one is a free attribute boost. You're trained in the Survival skill and the Life Science Lore skill. You gain the Experienced Tracker skill feat."
    },
    {
      "id": "ancient-elebrian",
      "name": "Ancient Elebrian",
      "rarity": "rare",
      "boosts": [
        [
          "cha",
          "int"
        ],
        [
          "cha",
          "con",
          "dex",
          "int",
          "str",
          "wis"
        ]
      ],
      "trainedSkills": [],
      "loreSkills": [
        "Eox Lore"
      ],
      "feat": null,
      "description": "You're an ancient resident of Eox. You might have survived in magitech stasis deep inside a ruined necropolis, or you might serve as the trusted, longtime attendant of an undying bone sage. You likely view modern life in the Pact Worlds with a mixture of amusement and contempt. Choose two attribute boosts. One must be to Intelligence or Charisma, and one is a free attribute boost. Choose a magic tradition. You're trained in that tradition's associated skill and the Eox Lore skill. Choose one 2nd-rank or lower spell from that tradition. You can cast this spell once per day as an innate spell."
    },
    {
      "id": "anomaly-hunter",
      "name": "Anomaly Hunter",
      "rarity": "uncommon",
      "boosts": [
        [
          "int",
          "wis"
        ],
        [
          "cha",
          "con",
          "dex",
          "int",
          "str",
          "wis"
        ]
      ],
      "trainedSkills": [],
      "loreSkills": [],
      "feat": "Oddity Identification",
      "description": "You're a paranormal investigator on the trail of a cosmic mystery, cryptid, or conspiracy. You might investigate the effects of the Newborn hatching from Aucturn, explore the Ghost Levels on Absalom Station, seek an explanation for the Gap, or try to unravel some other mystery. Choose two attribute boosts. One must be to Intelligence or Wisdom, and one is a free attribute boost. You're trained in four of the following skills: Arcana, Ghost Levels Lore, Nature, Occultism, Newborn Lore, Religion, Survival, or Stealth. You gain the Oddity Identification skill feat even if you don't meet the prerequisites."
    },
    {
      "id": "antediluvian-seeker",
      "name": "Antediluvian Seeker",
      "rarity": "common",
      "boosts": [